id,title,description,full_content,source,url,tickers,tags,published_date,crawled_date,ticker_count,tag_count,title_length,description_length,full_content_length
79216557,"BlackRock, Inc.'s Strategic Acquisition of iShares Core MSCI Total International Stock ETF Shares","On December 31, 2024, BlackRock, Inc. (Trades, Portfolio) executed a significant transaction by adding 22,517,022 shares of iShares Core MSCI Total Internationa","On December 31, 2024, BlackRock, Inc. (Trades, Portfolio) executed a significant transaction by adding 22,517,022 shares of iShares Core MSCI Total International Stock ETF (IXUS, Financial) to its portfolio. This acquisition increased BlackRock's total holdings in IXUS to 289,300,317 shares. The transaction was completed at a price of $66.14 per share, reflecting BlackRock's strategic move to bolster its position in this international stock ETF. This addition now represents 0.4% of BlackRock's extensive portfolio, highlighting the firm's commitment to diversifying its investment strategy. BlackRock, Inc. (Trades, Portfolio), headquartered at 50 Hudson Yards, New York, is a preeminent investment firm known for its robust investment philosophy and extensive portfolio. With a total equity of $4,761.16 trillion, BlackRock is a dominant player in the financial services and technology sectors. The firm's top holdings include major corporations such as Apple Inc (AAPL, Financial), Amazon.com Inc (AMZN, Financial), Meta Platforms Inc (META, Financial), Microsoft Corp (MSFT, Financial), and NVIDIA Corp (NVDA, Financial). BlackRock's investment approach is characterized by a focus on long-term growth and value, making strategic acquisitions like IXUS a key component of its portfolio management. Understanding iShares Core MSCI Total International Stock ETF (IXUS, Financial) iShares Core MSCI Total International Stock ETF (IXUS) is a prominent ETF with a market capitalization of $39.24 billion and a current stock price of $69.33. The ETF's financial metrics include a price-to-earnings (PE) ratio of 13.06 and a GF Score of 78/100, suggesting a likely average performance. IXUS's financial strength is further supported by a Balance Sheet Rank of 5.5/10 and a Profitability Rank of 7/10. These metrics indicate a stable financial foundation and a moderate growth trajectory. Impact on BlackRock's Portfolio The acquisition of additional IXUS shares has significantly impacted BlackRock's portfolio, increasing its position in the ETF to 51.10% of its holdings. This strategic move underscores BlackRock's confidence in the international markets and its commitment to enhancing portfolio diversification. The addition of IXUS aligns with BlackRock's investment philosophy of seeking growth opportunities across global markets, thereby strengthening its overall investment strategy. Performance and Valuation Insights Since the transaction, IXUS has experienced a 4.82% gain, with a year-to-date price change of 5.11%. However, investors should exercise caution when considering the GF Valuation, as the data is currently out of date. Despite this, IXUS's performance metrics, including a Operating Margin Growth of 2.63% and a Growth Rank of 7/10, indicate a positive outlook for the ETF. Comparative Analysis with Other Investment Firms In addition to BlackRock, other investment firms such as Private Capital (Trades, Portfolio) also hold positions in IXUS. Brandes Investment is currently the largest holder of IXUS shares among investment firms, highlighting the ETF's appeal to a diverse range of investors. This widespread interest in IXUS underscores its potential as a valuable component of a diversified investment portfolio. Conclusion: Strategic Implications for Value Investors BlackRock's recent acquisition of IXUS shares reflects a strategic decision to enhance its exposure to international markets. This move is likely to have significant implications for value investors, as it signals confidence in the growth potential of global equities. As BlackRock continues to refine its investment strategy, the addition of IXUS may serve as a catalyst for further portfolio diversification and long-term growth. Value investors should consider the potential impact of this transaction on the broader market and evaluate the opportunities presented by IXUS in the context of their investment objectives. This article, generated by GuruFocus, is designed to provide general insights and is not tailored financial advice. Our commentary is rooted in historical data and analyst projections, utilizing an impartial methodology, and is not intended to serve as specific investment guidance. It does not formulate a recommendation to purchase or divest any stock and does not consider individual investment objectives or financial circumstances. Our objective is to deliver long-term, fundamental data-driven analysis. Be aware that our analysis might not incorporate the most recent, price-sensitive company announcements or qualitative information. GuruFocus holds no position in the stocks mentioned herein.",gurufocus.com,https://www.gurufocus.com/news/2686173/blackrock-incs-strategic-acquisition-of-ishares-core-msci-total-international-stock-etf-shares,"['aapl', 'amzn', 'bcf', 'bgio', 'blk', 'ixus', 'meta', 'meta', 'metv', 'msft', 'ne-ws', 'nvda']","['Aapl', 'Amzn', 'Article', 'Consumer Cyclical', 'ETF', 'Financial Services', 'Gurufocus', 'Gurufocus News', 'Ixus', 'Meta', 'Msft', 'News', 'Nvda', 'Stock', 'Technology', 'Unknown Sector']",2025-02-07,2025-02-07,12,16,97,160,4627
79216559,"BlackRock, Inc. Reduces Stake in Tetra Tech Inc.","On December 31, 2024, BlackRock, Inc. (Trades, Portfolio) executed a strategic reduction in its holdings of Tetra Tech Inc. The transaction involved a decrease","On December 31, 2024, BlackRock, Inc. (Trades, Portfolio) executed a strategic reduction in its holdings of Tetra Tech Inc. The transaction involved a decrease of 187,704 shares, with the trade price set at $39.84 per share. This move reflects BlackRock's ongoing portfolio management strategy, which aims to optimize its investment positions across various sectors. Despite this reduction, BlackRock remains a significant shareholder in Tetra Tech, holding a total of 26,026,773 shares, which now represent 0.02% of the firm's extensive portfolio. BlackRock, Inc. (Trades, Portfolio), headquartered at 50 Hudson Yards, New York, NY, is a prominent investment firm known for its substantial equity holdings. With a total equity value of $4,761.16 trillion, BlackRock focuses primarily on the Technology and Financial Services sectors. The firm's top holdings include major companies such as Apple Inc. (AAPL, Financial), Amazon.com Inc. (AMZN, Financial), Meta Platforms Inc. (META, Financial), Microsoft Corp. (MSFT, Financial), and NVIDIA Corp. (NVDA, Financial). BlackRock's investment philosophy emphasizes diversification and strategic asset allocation to maximize returns for its clients. Understanding Tetra Tech Inc. Tetra Tech Inc., based in the USA, is a leading provider of consulting and engineering services, specializing in water-related services and infrastructure design. The company operates through two main segments: the Government Services Group (GSG) and the Commercial/International Services Group (CIG). Tetra Tech's expertise lies in environmental, infrastructure, resource management, energy, and international development markets. The company's ability to design complex infrastructure and manage resources effectively has positioned it as a key player in its industry. Financial Metrics and Valuation of Tetra Tech Inc. Tetra Tech Inc. currently has a market capitalization of $9.05 billion and a stock price of $33.78. The stock is considered modestly undervalued, with a GF Value of $42.63, indicating a Price to GF Value ratio of 0.79. This suggests that the stock is trading below its intrinsic value, offering potential upside for investors. The company's financial strength is further supported by a [GF Score](https://www.gurufocus.com/term/gf-score/TTEK) of 93/100, reflecting strong long-term performance potential. Performance and Growth Indicators Tetra Tech Inc. has demonstrated robust growth, with a 3-year revenue growth rate of 17.90% and an EBITDA growth rate of 24.70%. The company's [Profitability Rank](https://www.gurufocus.com/term/rank-profitability/TTEK) is 9/10, indicating a strong ability to generate profits. Additionally, Tetra Tech's [Growth Rank](https://www.gurufocus.com/term/rank-growth/TTEK) is 8/10, highlighting its capacity for sustained growth. The firm's [Operating Margin](https://www.gurufocus.com/term/operating-margin/TTEK) growth of 7.30% further underscores its operational efficiency. Impact of the Transaction The reduction in shares had a negligible impact on BlackRock, Inc. (Trades, Portfolio)'s portfolio, with the position in Tetra Tech Inc. now representing 0.02% of the firm's holdings. Despite the reduction, BlackRock remains a significant shareholder with 26,026,773 shares. This transaction aligns with BlackRock's strategy of maintaining a balanced and diversified portfolio while capitalizing on market opportunities. Other Notable Investors in Tetra Tech Inc. Fisher Asset Management, LLC holds the largest share percentage of Tetra Tech Inc., indicating strong confidence in the company's future prospects. Other prominent investors include Joel Greenblatt (Trades, Portfolio) and Jefferies Group (Trades, Portfolio), reflecting continued interest from major market players. This diverse investor base underscores Tetra Tech's appeal as a valuable investment opportunity in the consulting and engineering sector. This article, generated by GuruFocus, is designed to provide general insights and is not tailored financial advice. Our commentary is rooted in historical data and analyst projections, utilizing an impartial methodology, and is not intended to serve as specific investment guidance. It does not formulate a recommendation to purchase or divest any stock and does not consider individual investment objectives or financial circumstances. Our objective is to deliver long-term, fundamental data-driven analysis. Be aware that our analysis might not incorporate the most recent, price-sensitive company announcements or qualitative information. GuruFocus holds no position in the stocks mentioned herein.",gurufocus.com,https://www.gurufocus.com/news/2686170/blackrock-inc-reduces-stake-in-tetra-tech-inc,"['aapl', 'amzn', 'bcf', 'bgio', 'blk', 'meta', 'meta', 'metv', 'msft', 'ne-ws', 'nvda', 'ttek']","['Aapl', 'Amzn', 'Article', 'Consumer Cyclical', 'ETF', 'Financial Services', 'Gurufocus', 'Gurufocus News', 'Industrials', 'Meta', 'Msft', 'News', 'Nvda', 'Stock', 'Technology', 'Ttek', 'Unknown Sector']",2025-02-07,2025-02-07,12,17,48,159,4604
79216561,"BlackRock, Inc. Reduces Stake in The Chefs' Warehouse Inc","Transaction Overview On December 31, 2024, BlackRock, Inc. (Trades, Portfolio) made a strategic decision to reduce its holdings in The Chefs' Warehouse Inc (CHE","Transaction Overview On December 31, 2024, BlackRock, Inc. (Trades, Portfolio) made a strategic decision to reduce its holdings in The Chefs' Warehouse Inc (CHEF, Financial) by 7,404 shares. This transaction was executed at a price of $49.32 per share, bringing BlackRock's total shareholding in the company to 5,323,776 shares. The adjustment represents a minor change in BlackRock's portfolio, accounting for a 0.01% position. Despite the reduction, the stock has seen a positive market reaction, with its price increasing by 13.42% since the transaction. BlackRock, Inc. (Trades, Portfolio), headquartered at 50 Hudson Yards, New York, NY, is a leading global investment management firm. While the firm's specific investment philosophy is not detailed, its top holdings include major technology and financial services companies such as Apple Inc (AAPL, Financial), Amazon.com Inc (AMZN, Financial), Meta Platforms Inc (META, Financial), Microsoft Corp (MSFT, Financial), and NVIDIA Corp (NVDA, Financial). With an equity value of $4,761.16 trillion, BlackRock's portfolio is heavily weighted towards the technology and financial services sectors. About The Chefs' Warehouse Inc The Chefs' Warehouse Inc is a specialty food distributor operating in metropolitan areas across the United States and Canada. The company offers a diverse range of products, including cheese, cooking oils, chocolates, and meats, serving a variety of clients such as restaurants, hotels, and specialty food stores. With a market capitalization of $2.21 billion, the company's stock is currently priced at $55.94. The Chefs' Warehouse is considered modestly overvalued with a GF Value of $43.30, resulting in a Price to GF Value ratio of 1.29. Financial Metrics and Valuation The Chefs' Warehouse Inc has a Price-to-Earnings (P/E) ratio of 49.07, indicating a high valuation relative to its earnings. The company's [GF-Score](https://www.gurufocus.com/term/gf-score/CHEF) is 84/100, suggesting good outperformance potential. Over the past three years, the company has achieved a revenue growth rate of 31.70%, reflecting its strong market position. However, the [cash to debt](https://www.gurufocus.com/term/cash-to-debt/CHEF) ratio is low at 0.06, which may raise concerns about its financial leverage. Performance and Growth Indicators The Chefs' Warehouse Inc demonstrates robust growth and profitability metrics, with a [Profitability Rank](https://www.gurufocus.com/term/rank-profitability/CHEF) of 7/10 and a [Growth Rank](https://www.gurufocus.com/term/rank-growth/CHEF) of 8/10. The company's [Momentum Rank](https://www.gurufocus.com/term/rank-momentum/CHEF) is particularly strong at 9/10, indicating positive investor sentiment and stock performance. Despite these strengths, the company's [interest coverage](https://www.gurufocus.com/term/interest-coverage/CHEF) ratio of 2.46 suggests limited ability to cover interest expenses, which could be a potential risk factor. Largest Shareholder Information First Eagle Investment (Trades, Portfolio) Management, LLC is the largest shareholder of The Chefs' Warehouse Inc. While specific shareholding details are not provided, this indicates significant institutional interest in the company. Such backing can often provide stability and confidence in the company's future prospects. Implications of the Transaction The reduction in BlackRock's stake in The Chefs' Warehouse Inc is a minor portfolio adjustment, possibly driven by portfolio rebalancing or concerns over the stock's modest overvaluation. Despite this reduction, the stock has performed well, with a 13.42% increase in price since the transaction. This suggests that the market remains optimistic about the company's growth potential and operational performance. As BlackRock continues to manage its extensive portfolio, such strategic decisions are crucial in maintaining its investment objectives and maximizing returns. This article, generated by GuruFocus, is designed to provide general insights and is not tailored financial advice. Our commentary is rooted in historical data and analyst projections, utilizing an impartial methodology, and is not intended to serve as specific investment guidance. It does not formulate a recommendation to purchase or divest any stock and does not consider individual investment objectives or financial circumstances. Our objective is to deliver long-term, fundamental data-driven analysis. Be aware that our analysis might not incorporate the most recent, price-sensitive company announcements or qualitative information. GuruFocus holds no position in the stocks mentioned herein.",gurufocus.com,https://www.gurufocus.com/news/2686169/blackrock-inc-reduces-stake-in-the-chefs-warehouse-inc,"['aapl', 'amzn', 'bcf', 'bgio', 'blk', 'chef', 'meta', 'meta', 'metv', 'msft', 'ne-ws', 'nvda']","['Aapl', 'Amzn', 'Article', 'Chef', 'Consumer Cyclical', 'Consumer Defensive', 'ETF', 'Financial Services', 'Gurufocus', 'Gurufocus News', 'Meta', 'Msft', 'News', 'Nvda', 'Stock', 'Technology', 'Unknown Sector']",2025-02-07,2025-02-07,12,17,57,160,4625
79217891,Daily Open: Global central banks are cutting rates — the Fed might not be as inclined,"Many economies seem to be settling into a lower-rate environment. That’s in stark contrast with the Federal Reserve, which has to deal with volatile policies.","Taken from CNBC’s Daily Open, our international markets newsletter — [Subscribe today](https://www.cnbc.com/sign-up-for-cnbc-newsletters/) The Bank of England lowered interest rates by 25 basis points on Thursday, following the European Central Bank's cut of the same amount on Jan. 30. The Reserve Bank of India is also widely expectedly to trim its repo rate by 25 basis points when its policy meeting ends on Friday. Many economies seem to be settling into a lower-rate environment as policymakers look to boost economic growth. That's in stark contrast with the U.S. — it's unclear if the U.S. Federal Reserve would even deliver on its two rate cuts in 2025, forecast in December, given the uncertainties over the economic impact of U.S. President Donald Trump's policies. Ahead of Trump's inauguration, the U.S. dollar began strengthening and hit its highest level in more than two years, as measured by the U.S. dollar index. That's already affected companies such as Amazon, which blamed the currency for weighing down its expected revenue in the current quarter. U.S. exceptionalism might still be in place for now, but an edge can, after all, cut both ways. What you need to know today Disappointing guidance from Amazon[Amazon](/quotes/AMZN/) shares fell more than 4% after giving [disappointing revenue guidance for the current quarter](https://www.cnbc.com/2025/02/06/amazon-amzn-q4-earnings-report-2024.html), citing difficulties posed by a strong U.S. dollar. Based on the company's forecast, growth rate for the quarter would come in between 5% to 9%, the slowest increase since Amazon went public in 1997. That said, the tech giant beat earnings and revenue expectations for the fourth quarter — and is poised to surpass Walmart as the [S&P 500 company with the highest quarterly revenue](https://www.cnbc.com/2025/02/06/amazon-set-to-pass-walmart-in-revenue-for-first-time.html). Walmart reports on Feb. 20. Positive day for markets On Thursday, the [S&P 500](/quotes/.SPX/) advanced 0.36% for its [third consecutive winning day](https://www.cnbc.com/2025/02/05/stock-market-today-live-updates.html), while the [Nasdaq Composite](/quotes/.IXIC/) climbed 0.51%. The [Dow Jones Industrial Average](/quotes/.DJI/), however, lost 0.28%. Across the Atlantic, European markets were in a jubilant mood. The pan-European [Stoxx 600 index](/quotes/.STOXX/) rose 1.17%, [closing at a record high](https://www.cnbc.com/2025/02/06/european-markets-live-updates-stocks-news-data-and-earnings.html). The U.K.'s [FTSE 100](/quotes/.FTSE/) gained 1.21%, likewise hitting a new record. Bank of England cuts rates The [Bank of England lowered its benchmark interest rate](https://www.cnbc.com/2025/02/06/bank-of-england-restarts-monetary-easing-cutting-key-rate-to-4point5percent.html) by 25 basis points to 4.5%, its first cut of the year. All members of the monetary policy committee voted to lower rates, but two out of nine had voted for a larger cut of 50 basis points. Central bank governor Andrew Bailey said he expects more cuts this year. The BOE also halved its growth forecast for the U.K.'s economy in 2025 to 0.75% from 1.5%. China will respond to 'bullying' Tariffs imposed on China by U.S. Donald Trump have sparked a backlash by the world's second-biggest economy. [China will protect its interests](https://www.cnbc.com/2025/02/06/china-says-will-protect-its-own-interests-in-face-of-us-bullying-.html) ""in the face of one-sided acts of bullying,"" Chinese Ministry of Commerce Spokesperson He Yongqian said Thursday, according to a CNBC translation. However, He added that China would not provoke trade disputes and remained ready to [resolve problems through discussions](https://www.cnbc.com/2025/01/23/china-hopes-to-properly-manage-differences-with-the-us-on-trade.html). [PRO] IBM outperforms Nvidia Not [Nvidia](/quotes/NVDA/), not [Apple](/quotes/AAPL/) and not [Amazon](/quotes/AMZN/) — the best-performing stock in the Dow over the past three months has been [IBM](/quotes/IBM/), which climbed 27%. However, the tech company needs to [do more in the field of artificial intelligence](https://www.cnbc.com/2025/02/05/ibm-best-dow-stock-in-past-3-months-has-a-disappointing-ai-message.html) for its stock to continue performing well, according to one chief investment officer. And finally... [How Calvin Klein and Tommy Hilfiger got caught in Trump's trade war with China](https://www.cnbc.com/2025/02/06/calvin-klein-owner-pvh-blacklisted-in-china.html) China has blacklisted the owner of Calvin Klein and Tommy Hilfiger, which could force the company to shut down stores and manufacturing in the country, in an early repercussion of Trump's trade war. While China's Ministry of Commerce began investigating [PVH](/quotes/PVH/) September for allegedly refusing to source cotton from the Xinjiang region, which has become notorious for its Uyghur detention camps, Beijing officially placed the company on its list of ""unreliable entities"" on Tuesday.",cnbc.com,https://www.cnbc.com/2025/02/07/cnbc-daily-open-global-central-banks-are-cutting-rates-the-fed-might-not-be-as-inclined.html,"['aapl', 'amzn', 'nvda', 'pvh']","['Consumer Cyclical', 'Economic Events', 'Markets', 'Prices', 'Stock', 'Technology', 'Tiingo Top', 'World Markets']",2025-02-07,2025-02-07,4,8,85,158,4973
79217368,Amazon's quarterly beats took a back seat to a couple dings we're not going to sweat,We don't see these items as thesis-changing.,"Amazon logo on a brick building exterior, San Francisco, California, August 20, 2024. Smith Collection | Gado | Archive Photos | Getty Images [Amazon](/quotes/AMZN/) shares fell roughly 4% on Thursday evening despite the e-commerce and cloud giant reporting a stronger-than-expected fourth quarter after the closing bell. The market participants during extended trading took issue with a first-quarter 2025 forecast that missed estimates and a larger-than-expected capital expenditure plan. However, we don't see either item as thesis-changing.",cnbc.com,https://www.cnbc.com/2025/02/06/amazons-quarterly-beats-took-a-back-seat-to-a-couple-dings-were-not-going-to-sweat.html,"['amzn', 'googl', 'meta', 'meta', 'metv', 'msft', 'nvda', 'tgt', 'wmt']","['Advertising', 'Breaking News: Markets', 'Breaking News: Technology', 'Business', 'Computing', 'Consumer Cyclical', 'Consumer Defensive', 'ETF', 'Earnings', 'Internet', 'Investment Strategy', 'Markets', 'Stock', 'Technology', 'Tiingo Top', 'Wireless']",2025-02-06,2025-02-07,9,16,84,44,544
